{
  "schema_version": "0.1.0",
  "ignore_globs": [],
  "max_file_size_kb": 256,
  "context_budget": {
    "seed_file_limit": 12,
    "candidate_file_limit": 10,
    "hard_file_cap": 24,
    "max_file_chars": 18000,
    "max_snippet_chars": 1200
  },
  "reasoning_budget": {
    "default_profile": "balanced",
    "upgrade_triggers": [
      "只有证据不足时，才允许扩大上下文或升级推理强度。"
    ]
  },
  "permission_budget": {
    "allowed_tools": [],
    "confirmation_required": [
      "删除",
      "批量修改",
      "外部发送"
    ]
  },
  "data_budget": {
    "log_safe_fields": ["trace_id", "request_id", "decision_id", "plan_id", "tool_call_id"],
    "redact_fields": ["token", "cookie", "password", "secret", "authorization"],
    "forbidden_export_fields": []
  },
  "observability": {
    "log_globs": ["logs/*.log", "logs/*.txt", "logs/*.jsonl", "*.log", "*.txt", "*.jsonl"],
    "max_log_files": 8,
    "max_log_matches": 24,
    "max_log_line_chars": 240,
    "max_log_file_size_kb": 512
  },
  "validation_commands": {
    "quick": [],
    "precommit": [],
    "ship": []
  },
  "preferred_entry_files": [
    "README.md",
    "AGENTS.md",
    "ONBOARDING.md",
    "package.json",
    "pyproject.toml",
    "src/main.py"
  ],
  "risk_globs": [
    "migrations/*",
    "infra/*",
    "security/*",
    "auth/*",
    "payments/*"
  ],
  "documentation": {
    "canonical_docs": [
      "README.md",
      "ONBOARDING.md",
      "AGENTS.md",
      "docs/architecture-架构说明.md"
    ],
    "readme_priority_sections": [
      "这是什么",
      "这版新增了什么",
      "阶段路由",
      "核心工件",
      "文档同步原则",
      "快速开始",
      "默认工作流",
      "仓库结构"
    ],
    "section_rewrite_threshold": 2,
    "full_rewrite_threshold": 3
  }
}
